{"schema":"runtime-env/profile/v1","id":"bettor-arena-tech-lead-local","summary":"Bettor-arena local runtime plus the bounded multi-Worker scheduler for the first physical Agentic Tech Lead canary; Git Town and Forgejo activation remain separate admission lanes.","modules":["bettor-arena-proof","technical-equivalence-live","agent-actor-claude-code","agent-actor-codex-cli","model-replay-actor-agy","browser-transport-playwright-cdp","browser-transport-stealth-playwright","browser-transport-antigravity-puppeteer-cdp","browser-transport-chatgpt-chrome-extension","browser-transport-claude-in-chrome","openshell-agent-providers","forgejo-local-keychain-helper","multi-worker-scheduler"]}
